{
  "name": "Qounters-",
  "description": "Store brand version of Counters+ for the Quest version of Beat Saber. Adds a variety of configurable Qounters to display statistics in-game.",
  "id": "qounters-minus",
  "version": "1.0.2",
  "author": "Metalit,  danrouse",
  "authorIcon": "https://avatars.githubusercontent.com/u/128349?v=4",
  "modloader": "QuestLoader",
  "download": "https://github.com/danrouse/bsq-qounters-minus/releases/download/1.0.2/qounters-minus_v1.0.2.zip",
  "dependencies": [],
  "source": "https://github.com/danrouse/bsq-qounters-minus/",
  "cover": "https://raw.githubusercontent.com/danrouse/bsq-qounters-minus/master/cover.png",
  "funding": [],
  "website": null
}
