{
  "name": "Thicc Saber",
  "description": "A simple mod which allows you to control the dimensions of notes!",
  "id": "ThiccSaber",
  "version": "1.1.0",
  "author": "Bobby Shmurner",
  "authorIcon": "https://avatars.githubusercontent.com/u/34596112?v=4",
  "modloader": "QuestLoader",
  "download": "https://github.com/BobbyShmurner/ThiccSaber/releases/download/v1.1.0/Thicc_Saber-v1.1.0.qmod",
  "dependencies": [
    {
      "id": "codegen",
      "version": "^0.21.0"
    },
    {
      "id": "custom-types",
      "version": "^0.15.0"
    },
    {
      "id": "questui",
      "version": "^0.13.0"
    }
  ],
  "source": "https://github.com/BobbyShmurner/ThiccSaber/",
  "cover": "https://raw.githubusercontent.com/BobbyShmurner/ThiccSaber/master/cover.png",
  "funding": [],
  "website": null
}
