{
  "name": "CrashMod",
  "description": "Crash your game if you are bad and good\nFeatures:\n- Crash your mod via various triggers. e. g. Crash on Play, Miss, Good cut, Turn and way more",
  "id": "CrashMod",
  "version": "0.7.1",
  "author": "ComputerElite",
  "authorIcon": "https://avatars.githubusercontent.com/u/71177995?v=4",
  "modloader": "QuestLoader",
  "download": "https://github.com/ComputerElite/CrashMod/releases/download/0.7.1/CrashMod.qmod",
  "dependencies": [],
  "source": "https://github.com/ComputerElite/CrashMod/",
  "cover": "https://raw.githubusercontent.com/ComputerElite/CrashMod/main/cover.png",
  "funding": [],
  "website": null
}
