{
  "name": "SongDownloader",
  "description": "Download Custom Songs at Runtime",
  "id": "songdownloader",
  "version": "0.4.13",
  "author": "darknight1050, EnderdracheLP, Metalit",
  "authorIcon": "https://avatars.githubusercontent.com/u/18632205?v=4",
  "modloader": "QuestLoader",
  "download": "https://github.com/darknight1050/SongDownloader/releases/download/v0.4.13/SongDownloader.qmod",
  "dependencies": [
    {
      "id": "codegen",
      "version": "^0.26.2"
    },
    {
      "id": "custom-types",
      "version": "^0.15.21"
    },
    {
      "id": "questui",
      "version": "^0.16.7"
    },
    {
      "id": "songloader",
      "version": "^0.10.6"
    }
  ],
  "source": "https://github.com/darknight1050/SongDownloader/",
  "cover": "https://raw.githubusercontent.com/darknight1050/SongDownloader/master/cover.png",
  "funding": [],
  "website": "https://github.com/darknight1050/SongDownloader/"
}
