{
  "name": "QBeatSaberPlus-NoteTweaker",
  "description": "Feel good!",
  "id": "qbeatsaberplus-notetweaker",
  "version": "6.3.2",
  "author": "HardCPP",
  "authorIcon": "https://avatars.githubusercontent.com/u/2964819?v=4",
  "modloader": "Scotland2",
  "download": "https://github.com/hardcpp/QBeatSaberPlus-NoteTweaker/releases/download/v6.3.2/QBeatSaberPlus-NoteTweaker.qmod",
  "dependencies": [
    {
      "id": "chatplex-sdk-bs",
      "version": "^6.3.2"
    },
    {
      "id": "custom-types",
      "version": "^0.17.8"
    },
    {
      "id": "paper",
      "version": "^3.6.3"
    }
  ],
  "source": "https://github.com/hardcpp/QBeatSaberPlus-NoteTweaker/",
  "cover": "https://raw.githubusercontent.com/hardcpp/QBeatSaberPlus-NoteTweaker/master/cover.png",
  "funding": [],
  "website": "https://github.com/hardcpp/QBeatSaberPlus-NoteTweaker/"
}
