{
  "name": "Vent",
  "description": "I swear you just vented...",
  "id": "vent",
  "version": "1.0.0",
  "author": "IMB11 (IMB11)",
  "authorIcon": "https://avatars.githubusercontent.com/u/93472213?v=4",
  "modloader": "QuestLoader",
  "download": "https://github.com/IMB11/Vent/releases/download/1.0.0/Vent-1.0.0%2B1251.qmod",
  "dependencies": [
    {
      "id": "codegen",
      "version": "^0.28.0"
    },
    {
      "id": "custom-types",
      "version": "^0.15.22"
    },
    {
      "id": "questui",
      "version": "*"
    }
  ],
  "source": "https://github.com/IMB11/Vent/",
  "cover": "https://raw.githubusercontent.com/IMB11/Vent/master/cover.png",
  "funding": [],
  "website": null
}
