{
  "name": "MultiplayerCore",
  "description": "Port of MultiplayerCore, the PC mod that adds features to BeatTogether Multiplayer.",
  "id": "multiplayer-core",
  "version": "1.3.4",
  "author": "Goobie",
  "authorIcon": "https://avatars.githubusercontent.com/u/81266776?v=4",
  "modloader": "QuestLoader",
  "download": "https://github.com/EnderdracheLP/MultiplayerCore.Quest/releases/download/1.3.4/MultiplayerCore_1.3.4.qmod",
  "dependencies": [
    {
      "id": "BeatTogether",
      "version": "^1.7.1"
    },
    {
      "id": "codegen",
      "version": "^0.31.0"
    },
    {
      "id": "custom-types",
      "version": "^0.15.22"
    },
    {
      "id": "pinkcore",
      "version": "^1.8.6"
    },
    {
      "id": "questui",
      "version": "^0.17.9"
    },
    {
      "id": "songdownloader",
      "version": "^0.5.4"
    },
    {
      "id": "songloader",
      "version": "^0.10.12"
    }
  ],
  "source": "https://github.com/EnderdracheLP/MultiplayerCore.Quest/",
  "cover": "https://raw.githubusercontent.com/EnderdracheLP/MultiplayerCore.Quest/master/Cover.png",
  "funding": [],
  "website": null
}
