{
  "name": "ModList",
  "description": "Displays your installed mods inside the game and gives you a warning prompt upon starting the game to tell you if a mod failed to load.",
  "id": "mod-list",
  "version": "0.1.8",
  "author": "Lauriethefish",
  "authorIcon": "https://avatars.githubusercontent.com/u/44222319?v=4",
  "modloader": "QuestLoader",
  "download": "https://github.com/Lauriethefish/ModList/releases/download/v0.1.8/ModList.qmod",
  "dependencies": [
    {
      "id": "codegen",
      "version": "^0.29.0"
    },
    {
      "id": "custom-types",
      "version": "^0.15.22"
    },
    {
      "id": "questui",
      "version": "^0.17.6"
    }
  ],
  "source": "https://github.com/Lauriethefish/ModList/",
  "cover": "https://raw.githubusercontent.com/Lauriethefish/ModList/main/cover.png",
  "funding": [],
  "website": null
}
