{
  "name": "Codegen",
  "description": null,
  "id": "codegen",
  "version": "0.14.0",
  "author": "Sc2ad",
  "authorIcon": "https://avatars.githubusercontent.com/u/10663758?v=4",
  "modloader": "QuestLoader",
  "download": "https://github.com/sc2ad/BeatSaber-Quest-Codegen/releases/download/v0.14.0/codegen_0_14_0.qmod",
  "dependencies": [],
  "source": "https://github.com/sc2ad/BeatSaber-Quest-Codegen/",
  "cover": "https://raw.githubusercontent.com/sc2ad/BeatSaber-Quest-Codegen/master/cover.png",
  "funding": [],
  "website": null
}
