{
  "name": "QBeatSaberPlus-GameTweaker",
  "description": "Feel good!",
  "id": "qbeatsaberplus-gametweaker",
  "version": "1.0.0-v6.2.0",
  "author": "HardCPP",
  "authorIcon": "https://avatars.githubusercontent.com/u/2964819?v=4",
  "modloader": "QuestLoader",
  "download": "https://github.com/hardcpp/QBeatSaberPlus-GameTweaker/releases/download/v1.0.0-v6.2.0/QBeatSaberPlus-GameTweaker.qmod",
  "dependencies": [
    {
      "id": "chatplex-sdk-bs",
      "version": "^1.0.0-v6.2.0"
    },
    {
      "id": "codegen",
      "version": "^0.33.0"
    },
    {
      "id": "custom-types",
      "version": "^0.15.24"
    },
    {
      "id": "songloader",
      "version": "^0.10.15"
    }
  ],
  "source": "https://github.com/hardcpp/QBeatSaberPlus-GameTweaker/",
  "cover": "https://raw.githubusercontent.com/hardcpp/QBeatSaberPlus-GameTweaker/master/cover.png",
  "funding": [],
  "website": "https://github.com/hardcpp/QBeatSaberPlus-GameTweaker/"
}
