{
  "name": "SmallQubes",
  "description": "Adds a slider to change default cubes size",
  "id": "SmallQubes",
  "version": "0.3.1",
  "author": "NSGolova",
  "authorIcon": "https://avatars.githubusercontent.com/u/8793817?v=4",
  "modloader": "Scotland2",
  "download": "https://github.com/NSGolova/SmallQubes/releases/download/v0.3.1/SmallQubes.qmod",
  "dependencies": [
    {
      "id": "bsml",
      "version": "^0.4.34"
    },
    {
      "id": "custom-types",
      "version": "^0.17.8"
    },
    {
      "id": "paper",
      "version": "^3.6.3"
    }
  ],
  "source": "https://github.com/NSGolova/SmallQubes/",
  "cover": "https://raw.githubusercontent.com/NSGolova/SmallQubes/master/cover.png",
  "funding": [],
  "website": null
}
