{
  "name": "DlcSorter",
  "description": "Sorts the DLC packs alphabetically.",
  "id": "DlcSorter",
  "version": "0.1.10",
  "author": "DanTheMan827",
  "authorIcon": "https://avatars.githubusercontent.com/u/176073241?v=4",
  "modloader": "Scotland2",
  "download": "https://github.com/DanTheMan827-BeatSaber/Quest.DlcSorter/releases/download/v0.1.10/DlcSorter.qmod",
  "dependencies": [
    {
      "id": "beatsaber-hook",
      "version": "^6.4.1"
    },
    {
      "id": "paper2_scotland2",
      "version": "^4.6.1"
    }
  ],
  "source": "https://github.com/DanTheMan827-BeatSaber/Quest.DlcSorter/",
  "cover": "https://raw.githubusercontent.com/DanTheMan827-BeatSaber/Quest.DlcSorter/master/cover.png",
  "funding": [],
  "website": "https://github.com/DanTheMan827-BeatSaber/Quest.DlcSorter/"
}
