{
  "name": "BSNightcoreQuest",
  "description": "Removes pitch compensation to make songs go nightcore on different speed",
  "id": "BSNightcoreQuest",
  "version": "0.1.0",
  "author": "Tatenshi",
  "authorIcon": "https://avatars.githubusercontent.com/u/55283269?v=4",
  "modloader": "QuestLoader",
  "download": "https://github.com/Tatenshi/BSNightcoreQuest/releases/download/v0.1.0/BSNightcoreQuest_1_27_0.qmod",
  "dependencies": [
    {
      "id": "codegen",
      "version": "=0.32.0"
    },
    {
      "id": "custom-types",
      "version": "^0.15.22"
    },
    {
      "id": "questui",
      "version": "^0.17.10"
    }
  ],
  "source": "https://github.com/Tatenshi/BSNightcoreQuest/",
  "cover": null,
  "funding": [],
  "website": null
}
