{
  "name": "SafeStorage",
  "description": "Allows for safe storage and encryption of strings to prevent users from accidentally doxxing themselves",
  "id": "safestorage",
  "version": "1.1.1",
  "author": "hdgamer1404Jonas",
  "authorIcon": "https://avatars.githubusercontent.com/u/65252066?v=4",
  "modloader": "Scotland2",
  "download": "https://github.com/jxnxsdev/SafeStorage/releases/download/v1.1.1/SafeStorage.qmod",
  "dependencies": [],
  "source": "https://github.com/jxnxsdev/SafeStorage/",
  "cover": null,
  "funding": [],
  "website": "https://github.com/jxnxsdev/SafeStorage/"
}
