{
  "name": "BeatTogether",
  "description": "A multiplayer private server for the modding community. Supports crossplay between PC and Quest.",
  "id": "BeatTogether",
  "version": "1.0.1",
  "author": "BeatTogether Team",
  "authorIcon": "https://avatars.githubusercontent.com/u/9069824?v=4",
  "modloader": "QuestLoader",
  "download": "https://github.com/BeatTogether/BeatTogether.Quest/releases/download/v1.0.1/BeatTogether_v1.0.1.zip",
  "dependencies": [],
  "source": "https://github.com/BeatTogether/BeatTogether.Quest/",
  "cover": "https://raw.githubusercontent.com/BeatTogether/BeatTogether.Quest/master/Cover.png",
  "funding": [],
  "website": null
}
