{
  "name": "AnyText",
  "description": "Change any text in the game",
  "id": "anytext",
  "version": "1.0.1",
  "author": "CatsaCode",
  "authorIcon": "https://avatars.githubusercontent.com/u/155121307?v=4",
  "modloader": "Scotland2",
  "download": "https://github.com/CatsaCode/AnyText/releases/download/v1.0.1-bs-1.37.0/AnyText.qmod",
  "dependencies": [
    {
      "id": "bsml",
      "version": "^0.4.43"
    },
    {
      "id": "custom-types",
      "version": "^0.17.10"
    },
    {
      "id": "paper",
      "version": "^3.0.0"
    }
  ],
  "source": "https://github.com/CatsaCode/AnyText/",
  "cover": "https://raw.githubusercontent.com/CatsaCode/AnyText/main/cover.png",
  "funding": [],
  "website": "https://github.com/CatsaCode/AnyText/"
}
