{
  "name": "AntiVertigo",
  "description": "Spawns a plane or circle under you to help you deal with vertigo issues.",
  "id": "AntiVertigo",
  "version": "1.0.0",
  "author": "RedBrumbler",
  "authorIcon": "https://avatars.githubusercontent.com/u/51795403?v=4",
  "modloader": "QuestLoader",
  "download": "https://github.com/RedBrumbler/AntiVertigo/releases/download/1.0.0/AntiVertigo.zip",
  "dependencies": [],
  "source": "https://github.com/RedBrumbler/AntiVertigo/",
  "cover": "https://raw.githubusercontent.com/RedBrumbler/AntiVertigo/master/cover.png",
  "funding": [],
  "website": null
}
