{
  "name": "LeaderboardCore",
  "description": "Adds the capability to add custom leaderboards to Beat Saber with relative ease!",
  "id": "leaderboardcore",
  "version": "0.0.3",
  "author": "Raine, RedBrumbler",
  "authorIcon": "https://avatars.githubusercontent.com/u/64136899?v=4",
  "modloader": "QuestLoader",
  "download": "https://github.com/raineaeternal/LeaderboardCore/releases/download/v0.0.3/LeaderboardCore.qmod",
  "dependencies": [
    {
      "id": "bsml",
      "version": "^0.3.1"
    },
    {
      "id": "codegen",
      "version": "^0.33.0"
    },
    {
      "id": "custom-types",
      "version": "^0.15.23"
    },
    {
      "id": "lapiz",
      "version": "^0.1.11"
    },
    {
      "id": "paper",
      "version": "^1.2.9"
    }
  ],
  "source": "https://github.com/raineaeternal/LeaderboardCore/",
  "cover": null,
  "funding": [],
  "website": "https://github.com/raineaeternal/LeaderboardCore/"
}
